{
  "source": "kosha",
  "source_type": "portal_api",
  "doc_category": "kosha_opl",
  "source_id": "30206",
  "title": "(일상생활용 전기기계기구제조업)비딩기 안전작업",
  "title_normalized": "(일상생활용 전기기계기구제조업)비딩기 안전작업",
  "body_text": "www.kosha.or.kr\n일상생활용 \n전기기계기구제조업\n2011-교육미디어-1651\n비딩기 안전작업\nBeading machine\n판금(板金) 성형 가공 설비의 일종으로서, 편편한 판금 또는 성형된 판금에 줄 모양의 돌기(突起; bead)를 \n넣는 가공설비이다. 평판에 오픈 비딩을 연속적으로 넣으면 파형 성형이 된다.\n비딩기란?\n맨드릴\n공작물\n롤\n비드\n비딩기 작업원리\n비딩기 전경\n\nwww.kosha.or.kr\n동력전달부 방호덮개\n광전자식 안전장치\n\u0007금형과 금형 사이에 협착 \n철판을 금형위에 올려주고 서로 압착하기 위해 전원을 투입하여 상부 금형이 내려와 압착시켜 주는 \n작업 시 손 협착위험이 있음\n\u0007장기간 서서 작업 시 근골격계질환 재해 발생 위험\n\u0007철판 모서리부에 베일위험이 있음\n\u0007설비 점검·보수작업 시 타작업자의 오조작 위험\n● \u0007광전자식 안전장치 및 양수조작식 안전장치 설치\n● 비상정지장치 설치\n● \u0007몰드의 탈·부착 시 외관점검, 운반 및 부착방법의 \n순서를 정하여 신중하게 실시\n● \u0007작업자의 자세가 무리하거나 불편하지 않도록 피로\n예방매트 설치\n● 동력전달부에 방호덮개 설치\n● 정해진 수공구 및 지그를 사용\n● 작업에 적합한 보호구 착용\n● 부품의 점검, 재료의 확인, 주유, 청소 시 기계는 반드시 정지 확인\n주요 위험요인\n안전대책\n비딩기 안전작업\n\nwww.kosha.or.kr\n프라즈마 가공된 철판을 비딩작업을 위하여 비딩기계에 손으로 밀어 넣는 작업 중 착용하고 있던 \n장갑이 회전부에 빨려 들어가 손가락 절단\n● \u0007광전자식 안전장치 설치\n협착위험이 있는 위험장소에 접근하면 즉시 기계작동이 정지할 수 있는 광전자식 안전장치 설치\n● \u0007양수조작식 안전장치 설치\n\u0007소재투입 후 양수조작이 가능한 작업 시에는 양수조작식 안전장치를 설치하여 작업 실시\n● \u0007장갑을 착용하여 작업할 경우 밀착되는 가죽제 장갑을 착용하여 작업 실시 \n재해사례 : 철판을 비딩기에 투입하던 중 협착\n● \u0007광전자식 안전장치 미설치\n● \u0007양수조작식 안전장치 미설치\n● \u0007면장갑을 착용상태에서 작업 실시 \n발생원인\n개요\n예방대책\n비딩기 안전작업\n\nwww.kosha.or.kr\n일상생활용 전기기계기구제조업\n● \u0007몰드부착 및 점검 시 조치하여야 할 사항\n- 몰드 부착준비는 정확성을 기할 것\n- 몰드 부착 순서의 정확성 유지\n- 몰드 부착정도 점검\n● \u0007안전담당자를 지정하여 작업 전 안전점검을 실시\n- \u0007방호장치의 설치 및 작업성에 대한 여부\n- \u0007슬라이드 작동상 이상 유무\n- 작업자 주변의 정리정돈 상태\n● \u0007작업 시 안전한 작업 요령\n- 작업 중 회전부내로 손이 들어가지 않도록 수시 교육 실시\n- \u0007작업장 이상소음 및 계기 등의 지침을 수시점검(1일 2회 이상) 실시\n- \u0007작업 종료 시 정리정돈을 철저히 실시\n● \u0007전환 키스위치인 경우 다음 사항을 준수\n- 전환 키스위치는 어느 쪽으로도 전환 가능토록 함 \n- 전환 키스위치는 연속, 안전, 미동행정에 사용\n- 안전장치 ON/OFF 전환이 필요한 경우 키는 안전담당자가 별도 보관 조치\n● \u0007작업 전 반드시 광전식 및 양수조작 안전장치 정상작동여부를 점검한다. \n안전수칙\n관련 법령\n● \u0007산업안전기준에 관한 규칙 \n- 제9조 (작업발판 등)\t\n- 제32조 (보호구의 지급 등)\n- 제87조 (원동기·회전축 등의 위험장지)\t\n- 제88조 (기계의 동력차단장치)\n- 제89조 (운전 시작 전 조치)\t\n- 제91조 (고장 난 기계의 정비 등)\n- 제302조 (전기기계·기구의 접지)\t\n- 제313조 (배선 등의 절연피복 등) \n● \u0007고용노동부 고시 제93-41호 제2000-16호 위험기계·기구 방호장치, 성능검정 기준\n비딩기 안전작업",
  "has_text": true,
  "content_length": 1782,
  "hazards": [
    "추락",
    "끼임",
    "감전",
    "중량물",
    "화학물질",
    "협착",
    "비래낙하",
    "소음진동",
    "온도"
  ],
  "work_types": [
    "용접",
    "전기",
    "운반",
    "기계정비",
    "절단",
    "청소"
  ],
  "equipment": [
    "전동공구",
    "프레스",
    "안전대"
  ],
  "tags": [],
  "url": "https://portal.kosha.or.kr/api/portal24/bizA/p/files/downloadAtchFile?atcflNo=FL00014166155&atcflSeq=1",
  "file_url": "https://portal.kosha.or.kr/api/portal24/bizA/p/files/downloadAtchFile?atcflNo=FL00014166155&atcflSeq=1",
  "pdf_path": "",
  "file_sha256": "",
  "industry": "제조업",
  "published_at": "20120316",
  "collected_at": "2026-04-22",
  "language": "ko",
  "status": "mapped"
}