{
  "source": "kosha",
  "source_type": "portal_api",
  "doc_category": "kosha_opl",
  "source_id": "33462",
  "title": "[중대재해_비금속]산업용 로봇 점검 중 부딪힘",
  "title_normalized": "산업용 로봇 점검 중 부딪힘",
  "body_text": "산업용 로봇을 이용하여 자재(판재)를 프레스에 공급하는 공정에서 설비를 점검하기 위해 로봇 작동 범위로 \n접근하여 작업 중 로봇에 부착된 지그가 전진하면서 부딪힘\n재해발생 원인\n!\n안전작업 방법\n산업용 로봇의 수리 등 작업시의 안전조치 실시 \n- 로봇의 작동 범위 내에서 수리·검사 등의 작업시 운전 정지\n   (전원차단)\n- 기동스위치에“작업중”표지판 부착 및 열쇠로 잠근 후 별도 \n   관리하는 등 추가 조치 후 작업 실시\n산업용 로봇 운전 중 접촉방지 조치 실시\n- 로봇 운전 중 접촉 위험이 없도록 방책 및 로봇 운전정지 연동 \n   방호장치인 안전매트 또는 감응센서를 설치\n산업용 로봇의 수리 등의 작업시 운전정지(전원 차단) \n미실시\n산업용 로봇 작동범위 위험방지를 위한 방책 및 안전매트\n미설치 \n산업용 로봇 점검 중 부딪힘\nTIP\n1\n1\n2\n2\n2013-교육미디어-1315\n제조업\n재해사례\n(산업용 로봇)\n\n●  산업안전보건기준에 관한 규칙    제35조(관리감독자의 유해·위험 방지 업무 등), 제92조(정비 등의 작업시의 운전정지 등)\n                                                제223조(운전 중의 위험 방지), 제224조(수리 등 작업시의 조치 등)\n만화로 보는 재해사례\n산업용 로봇 점검 작업, 운전 정지는 기본입니다 !\n산업용 로봇 점검 중 부딪힘\n참고법령 및 기준\n法",
  "has_text": true,
  "content_length": 693,
  "hazards": [
    "끼임",
    "충돌",
    "화학물질",
    "비래낙하"
  ],
  "work_types": [
    "기계정비"
  ],
  "equipment": [
    "프레스"
  ],
  "tags": [],
  "url": "https://portal.kosha.or.kr/api/portal24/bizA/p/files/downloadAtchFile?atcflNo=FL00014169241&atcflSeq=1",
  "file_url": "https://portal.kosha.or.kr/api/portal24/bizA/p/files/downloadAtchFile?atcflNo=FL00014169241&atcflSeq=1",
  "pdf_path": "",
  "file_sha256": "",
  "industry": "제조업",
  "published_at": "20131216",
  "collected_at": "2026-04-22",
  "language": "ko",
  "status": "mapped"
}