{
  "source": "kosha",
  "source_type": "portal_api",
  "doc_category": "kosha_opl",
  "source_id": "43187",
  "title": "사고다발 위험 설비 Key message(컨베이어)",
  "title_normalized": "사고다발 위험 설비 Key message(컨베이어)",
  "body_text": "컨베이어\n돌발정지시\n䥅원\n차단\n2021-산업안전보건인증원-262",
  "has_text": false,
  "content_length": 35,
  "hazards": [
    "화학물질"
  ],
  "work_types": [],
  "equipment": [
    "컨베이어"
  ],
  "tags": [],
  "url": "https://portal.kosha.or.kr/api/portal24/bizA/p/files/downloadAtchFile?atcflNo=FL00016180801&atcflSeq=1",
  "file_url": "https://portal.kosha.or.kr/api/portal24/bizA/p/files/downloadAtchFile?atcflNo=FL00016180801&atcflSeq=1",
  "pdf_path": "",
  "file_sha256": "",
  "industry": "제조업",
  "published_at": "20210617",
  "collected_at": "2026-04-22",
  "language": "ko",
  "status": "mapped"
}