{
  "source": "kosha",
  "source_type": "portal_api",
  "doc_category": "kosha_opl",
  "source_id": "46787",
  "title": "육상화물취급업(이사) 안전작업가이드",
  "title_normalized": "육상화물취급업(이사) 안전작업가이드",
  "body_text": "* 「위험기계·기구 안전인증 고시」 제8조\n화물자동차 등 차량 위에 사다리 붐을 탑재하여 이삿짐 운반 등에 사용하며\n‘고가 사다리차’ 라고 부르기도 함\n연장 및 축소가 가능하고 끝단을 건축물 등에 지지하는 구조의 사다리 붐을 따라 \n화물을 운반하는 설비\n1\n이삿짐 운반용 리프트\n붐 최대상승\n제한 장치\n사다리 자동감속 및 정지장치\n아웃트리거\n하중감지 및 경보장치\n차량\n주행 방지 장치\n아웃트리거 지지\n감지장치\n유압 안전밸브\n체크밸브, 릴리프밸브\n카운터밸런스 밸브\n붐/아웃트리거\n인터룩 시스템\n턴테이블\n회전방지장치\n운반구\n낙하방지장치\n비상정지장치\n사다리\n제어 및 경보장치\n사다리\n전도방지장치\n권과방지장치\n과부하방지장치\n2024-교육혁신실-772\n주요 구조 및 방호장치\n육상화물취급업 \n재해예방 안전작업가이드\n※ 기타 세부적인 방호장치 내용은 「위험기계·기구 안전인증 고시」 참조\n\n•\u0001작업 후 사다리 붐을 고정물에서 떼어낼 때 흔들림에 \n의한 전도 위험\n•\u0001작업 전 사다리, 운반구, 아웃트리거, 턴테이블 등 각 부위의 이상유무를 확인\n•\u0001사용한계를 초과하여 사다리붐을 인출하여 붐대 꺾임 \n또는 사다리차 전도 위험\n•\u0001차량이 전복되지 않도록 아웃트리거 수평 유지 및 침하방지 조치 등 철저\n•\u0001안전인증 및 안전검사 미실시 또는 누락 등으로 인한 \n사다리차 안전성 미확보\n•\u0001작업 반경 내, 나무 등으로 인한 부딪힘 또는 번개, 전기선 등에 의한 감전위험이 없는지 확인\n•차량 조종 능력 미숙 등에 의한 차량 전도\n•작업 전 주차 브레이크를 체결하고 차량이 움직이지 않도록 고임목 등으로 고정\n•\u0001작업반경 인접 주변환경 미확인으로 전선, 건물 등에 \n접촉 및 부딪힘\n•사다리 붐 인출 상태에서 아웃트리거 조작 금지\n2 주요 재해유형\n3 안전작업방법\n작업 전 \n•\u0001이삿짐 운반 작업 반경 내 사람의 통행을 제한할 수 있는 조치 실시\n•\u0001이삿짐 운반용 사다리는 설계 기준각도 이내로 건물벽과 고정되도록 설치\n•\u0001감전 위험이 있거나 12.5m/sec 이상의 강풍이 부는 경우 작업 금지\n•\u0001사다리차로 크레인 형태의 작업 실시 또는 붐·운반구 일부를 다른 구조물을 지지하는 용도로 사용 금지\n•\u0001사다리는 반드시 단단한 곳에 지지하여 설치한 후 운반구를 작동하고, 사다리를 공중에 띄우거나 \n건물 벽과 떨어진 상태에서 작업 금지\n•작업 근로자는 개인보호구(안전모, 안전화, 안전대 등)를 착용\n•리프트 넘어짐 방지를 위해 사다리붐을 45m 이상 인출, 인유입 시 유도로프(가잉로프) 사용\n작업 시\n* 유도로프: 사다리붐 인출, 인입 시 사다리 끝단을 당겨서 지지하는 로프\n•작업 후에는 사다리 붐을 내려 원위치 시키고 운반구를 고정한 후 차량 운행\n•사다리 붐 인출 상태에서 차량 이동 금지\n운반구에서 떨어짐\n사다리 붐 꺾임\n인근 전선 접촉 및 정전\n사다리차 넘어짐\n관련볍령 및 참고자료\n•\u0001KOSHA GUIDE 「 이삿짐 운반용 리프트 작업의 리스크 확인 지침 (X-36-2016)」\n•\u0001산업안전보건기준에 관한 규칙 제157조(이삿짐운반용 리프트 운전방법의 주지), 제158조(이삿짐운반용 리프트의 전도\n방지), 제159조(화물의 낙하 방지)\n•산업안전보건법 제84조(안전인증), 제93조(안전검사)\n\n이삿짐 운반용 리프트 체크리스트\n구분\n확인사항\n적정여부\n기계\n작동\n안전인증 및 안전검사 수검 여부 확인\n사다리 붐 조립체, 턴테이블, 운반구, 아웃트리거 등 각 부위 이상유무 확인\n동력 인출장치, 윈치, 도르래, 전기장치 등의 이상 및 정상작동 여부 확인\n운반구 수평조절장치 정상 작동 여부\n급정지장치, 과부하방지장치, 비상정지장치, 경보장치 등 방호장치 이상 및\u0001\n정상작동 여부 확인\n붐 상승상태에서 아웃트리거 작동이 불가하도록 연동 인터록 장치 확인\n아웃트리거 전도방지 장치 정상 작동 여부 (지면접촉 상태 이상 시 경보 발생)\n운반 화물의 낙하방지 조치 여부 (로프 체결 또는 편하중이 생기지 않도록 조치 확인)\n권과방지장치 정상 작동 여부 (운반구 과상승 시 사다리 최상부 도달 전 자동정지 여부)\n와이어로프 결함 여부 확인 (지름감소 7% 초과, 소선절단 10%이상 시 사용금지)\n조작부분의 명칭 및 표시상태 확인\n작업\n환경\n조건\n운반구에 근로자 탑승 금지 조치 및 안전보건교육 실시\n작업반경 내 통행 및 출입 금지 조치 실시\n작업 시작 전 풍속이 제작사의 설계기준 이내 여부\n작업장소 주변의 고압전선, 건물, 나무 등의 유무\n적재물 형상의 균일여부 및 작업높이 등의 적정\n사다리가 건물과 정확하게 고정되었는지 여부\n운반구의 화물 중량이 제작사의 설계기준을 충족하는지 여부\n안전장치 임의해제 여부 및 정상작동 여부를 확인\n※ 본 체크리스트는 참고사항이므로 사업장 및 작업특성에 맞도록 항목을 추가하여 사용하세요.\n확인일자\n확인자",
  "has_text": true,
  "content_length": 2312,
  "hazards": [
    "추락",
    "충돌",
    "붕괴",
    "감전",
    "중량물",
    "화학물질",
    "전도",
    "비래낙하"
  ],
  "work_types": [
    "용접",
    "전기",
    "배관",
    "운반",
    "절단"
  ],
  "equipment": [
    "사다리",
    "크레인",
    "안전대"
  ],
  "tags": [],
  "url": "https://portal.kosha.or.kr/api/portal24/bizA/p/files/downloadAtchFile?atcflNo=FL00021295376&atcflSeq=1",
  "file_url": "https://portal.kosha.or.kr/api/portal24/bizA/p/files/downloadAtchFile?atcflNo=FL00021295376&atcflSeq=1",
  "pdf_path": "",
  "file_sha256": "",
  "industry": "제조업",
  "published_at": "20241223",
  "collected_at": "2026-04-22",
  "language": "ko",
  "status": "mapped"
}