{
  "source": "kosha",
  "source_type": "portal_api",
  "doc_category": "kosha_opl",
  "source_id": "42901",
  "title": "건설업 기초안전보건교육 변경사항 안내",
  "title_normalized": "건설업 기초안전보건교육 변경사항 안내",
  "body_text": "건설업\n기초안전보건교육\n변경사항 안내\n기초안전보건교육\n변경사항 안내\n최근 이천 냉동창고 화재사고 등 건설현장의 화재·폭발사고를 예방하고\n건설업 기초안전보건교육 이수여부 확인의 편리성을 높이기 위해 관련 제도가 변경되었습니다.\n5.4cm\n내국인\n외국인\n이수자 본인 확인이 가능한 증빙 자료를 교육기관에서 등록하도록 하여 \n교육이수의 투명성 제고\n이수증에 QR코드를 추가하여 이수여부를 확인토록 개선\n외국인은 국적·체류자격 및 체류기간을 함께 표기\n2 교육이수자 확인의 편리성을 높였습니다.\n2020-교육홍보본부-937\n안전보건교육규정(고용노동부 고시 제2020-129호) 일부 개정(’20.11.17.시행)\n1 교육내용에 화재·폭발 예방에 관한 사항이 추가되었습니다\n교 육 내 용\n구분\n공통\n교육대상별\n시간\n1시간\n1시간\n2시간\n•산업안전보건법 주요내용 및 안전의식 제고\n•건설 직종별 건강장해 위험요인과 건강관리\n•작업별 위험요인과 안전작업 방법(재해사례 및 예방대책)\n   ※ 보호구(안전대·안전보·안전화)착용 및 화재·폭발 예방을  \n       위한 안전수칙·피난교육에 관한 사항을 1시간 이상 실시\n* 화재·폭발사고예방 표준교안은 안전보건공단 홈페이지(www.kosha.or.kr) 안전보건자료실 참조\n관련 규정\n•제13조의2(교육방법 및 수강생의 관리 등) \n관련 규정\n•제13조의5(건설업기초교육 이수증 발급 등)\n•별표4(건설업 기초안전보건교육 이수증)",
  "has_text": true,
  "content_length": 708,
  "hazards": [
    "화재폭발",
    "화학물질",
    "온도"
  ],
  "work_types": [],
  "equipment": [
    "안전대"
  ],
  "tags": [],
  "url": "https://portal.kosha.or.kr/api/portal24/bizA/p/files/downloadAtchFile?atcflNo=FL00015997733&atcflSeq=1",
  "file_url": "https://portal.kosha.or.kr/api/portal24/bizA/p/files/downloadAtchFile?atcflNo=FL00015997733&atcflSeq=1",
  "pdf_path": "",
  "file_sha256": "",
  "industry": "건설업",
  "published_at": "20210107",
  "collected_at": "2026-04-22",
  "language": "ko",
  "status": "mapped"
}