{
  "source": "kosha",
  "source_type": "portal_api",
  "doc_category": "kosha_opl",
  "source_id": "31281",
  "title": "플라스틱 제품용 기계조작 종사자 - 고속 분쇄작업",
  "title_normalized": "플라스틱 제품용 기계조작 종사자 - 고속 분쇄작업",
  "body_text": "끼임(손)\n끼임(손)\n소음\n전도(넘어짐)\n주요위험요인\n작업안전대책\nwww.kosha.or.krⅠ032-5100-500\n●분쇄기에서분쇄작업중손이끼임\n●분쇄기작동시발생되는높은\n소음에노출\n●분쇄기주변에비산한분쇄물을\n밟아미끄러져넘어짐\n●분쇄기에분쇄물과다투입금지\n●분쇄물투입용보조기구사용\n●투입구에안전망설치\n귀덮개등차음용보호구착용\n분쇄물투입봉사용\n●고속분쇄작업시귀덮개등차음용보호구착용\n●분쇄작업장을별도로설치하여격리조치\n소음\n●분쇄기주변비산물청소\n●작업장바닥정리정돈실시\n●작업장내안전통로확보\n전도(넘어짐)\n\nwww.kosha.or.krⅠ032-5100-500\n플라스틱제품용기계조작종사자-고속분쇄작업\n2012-교육미디어-761\n재해사례개요\n고속분쇄기에사출잔재물을투입하던중과다하게투입된잔재물이투입구에\n걸리자손으로밀어넣던중분쇄기날사이에손이끼임\n분쇄작업시보조기구를사용하고, 한꺼번에많이넣지마세요!\n분쇄작업시\n보조기구를사용하고,\n분쇄기에한꺼번에\n많이넣지마세요!",
  "has_text": false,
  "content_length": 470,
  "hazards": [
    "끼임",
    "화학물질",
    "협착",
    "전도",
    "소음진동"
  ],
  "work_types": [
    "청소"
  ],
  "equipment": [
    "안전대"
  ],
  "tags": [],
  "url": "https://portal.kosha.or.kr/api/portal24/bizA/p/files/downloadAtchFile?atcflNo=FL00014167150&atcflSeq=1",
  "file_url": "https://portal.kosha.or.kr/api/portal24/bizA/p/files/downloadAtchFile?atcflNo=FL00014167150&atcflSeq=1",
  "pdf_path": "",
  "file_sha256": "",
  "industry": "제조업",
  "published_at": "20121204",
  "collected_at": "2026-04-22",
  "language": "ko",
  "status": "mapped"
}