{
  "source": "kosha",
  "source_type": "portal_api",
  "doc_category": "kosha_opl",
  "source_id": "43459",
  "title": "[Quick Message] 엘리베이터용 피트 작업 중 추락사고 속보",
  "title_normalized": "엘리베이터용 피트 작업 중 추락사고 속보",
  "body_text": "",
  "has_text": false,
  "content_length": 0,
  "hazards": [
    "추락"
  ],
  "work_types": [
    "밀폐공간"
  ],
  "equipment": [],
  "tags": [],
  "url": "https://portal.kosha.or.kr/api/portal24/bizA/p/files/downloadAtchFile?atcflNo=FL00016274052&atcflSeq=1",
  "file_url": "https://portal.kosha.or.kr/api/portal24/bizA/p/files/downloadAtchFile?atcflNo=FL00016274052&atcflSeq=1",
  "pdf_path": "",
  "file_sha256": "",
  "industry": "건설업",
  "published_at": "20210901",
  "collected_at": "2026-04-22",
  "language": "ko",
  "status": "mapped"
}