{
  "source": "kosha",
  "source_type": "portal_api",
  "doc_category": "kosha_opl",
  "source_id": "39910",
  "title": "용접·용단 작업 화재·폭발 사망사고 예방",
  "title_normalized": "용접·용단 작업 화재·폭발 사망사고 예방",
  "body_text": "2018-교육미디어-706\n 용접·용단 작업\n화재·폭발 사망사고 예방\n작업 전 충분한 환기를 실시하고 \n가연물을 제거\n1\n작업 시 용접불티 비산방지덮개,\n용접방화포 등을 설치\n2\n화재감시자 배치\n3\n환기·가연물 제거\n불티비산방지포 설치\n화재감시자 배치\n「국민생명 지키기 프로젝트」\n사망사고예방 이것만은 지키자\n!\n실천사항 1\n실천사항 2\n실천사항 3\n핵심 실천사항\n사고사례\nLPG·산소를 사용하여 천장 \n에어컨 배관라인 용접작업 중 \n불꽃이 우레탄 폼에 옮겨 붙어 \n발화되어 연기 등에 의해 질식 \n사망\n조선소에서 건조 중이던 선박 \n에서 블록내부 취부·용접 작업을 \n위해 장소로 이동 중 내부에 \n체류된 에틸렌가스 폭발로 사망\n지하저수조 내부 방수제 도포 \n후 저수조 통행용 스테인리스 \n사다리를 설치하기 위해 지지용 \n앵커 볼트를 가용접하던 중 \n폭발하여 사망\n사례1\n사례2\n사례3\n배관라인 용접작업 중 우레탄 \n폼에 불꽃이 옮겨 붙어 화재 발생\n블록 내부 취부·용접작업 \n준비 중 화재·폭발\n지하저수조에서 용접 중 \n방수제 유기용제 폭발\n\n 용접·용단 작업 화재·폭발 사망사고 예방\n가연물 등이 있는 장소에서 용접·용단작업에 따른 화재·폭발 위험\n환기가 불충분한 장소에서 용접·용단작업 시 가스 누출 여부 미확인에 따른 화재·폭발 위험\n인화성 액체의 증기에 대한 통풍 및 환기조치 미실시에 따른 화재·폭발 위험\n1\n2\n3\n주요 점검항목\n 주요 위험포인트\n항목 1\n항목 2\n항목 3\n인화성 액체의 증기, 인화성 가스 \n등을 제거하기 위한 충분한 \n환기 실시\n용접·용단 작업 전 가연성 물질, \n인화성·폭발성 위험물 제거·\n격리\n용접불티 비산에 따른 화재· \n폭발을 예방하기 위한 용접불티 \n비산방지덮개, 용접방화포 등 \n비치 및 사용\n화재의 위험을 감시하고 화재 \n발생 시 사업장 내 근로자 대피를 \n유도하는 업무만을 담당하는 \n화재감시자 지정 및 배치 \n환기·가연물 제거\n불티비산 방지조치\n화재감시자 배치",
  "has_text": true,
  "content_length": 957,
  "hazards": [
    "추락",
    "화재폭발",
    "질식",
    "화학물질",
    "협착"
  ],
  "work_types": [
    "용접",
    "배관",
    "지붕",
    "운반",
    "기계정비",
    "방수",
    "조적"
  ],
  "equipment": [
    "사다리"
  ],
  "tags": [],
  "url": "https://portal.kosha.or.kr/api/portal24/bizA/p/files/downloadAtchFile?atcflNo=FL00014175338&atcflSeq=1",
  "file_url": "https://portal.kosha.or.kr/api/portal24/bizA/p/files/downloadAtchFile?atcflNo=FL00014175338&atcflSeq=1",
  "pdf_path": "",
  "file_sha256": "",
  "industry": "제조업",
  "published_at": "20181106",
  "collected_at": "2026-04-22",
  "language": "ko",
  "status": "mapped"
}