{
  "source": "kosha",
  "source_type": "portal_api",
  "doc_category": "kosha_opl",
  "source_id": "46486",
  "title": "사고다발 위험설비 Key Message(혼합기,파쇄기,분쇄기)",
  "title_normalized": "사고다발 위험설비 Key Message(혼합기,파쇄기,분쇄기)",
  "body_text": "",
  "has_text": false,
  "content_length": 0,
  "hazards": [],
  "work_types": [],
  "equipment": [],
  "tags": [],
  "url": "https://portal.kosha.or.kr/api/portal24/bizA/p/files/downloadAtchFile?atcflNo=FL00021243100&atcflSeq=1",
  "file_url": "https://portal.kosha.or.kr/api/portal24/bizA/p/files/downloadAtchFile?atcflNo=FL00021243100&atcflSeq=1",
  "pdf_path": "",
  "file_sha256": "",
  "industry": "제조업",
  "published_at": "20241217",
  "collected_at": "2026-04-22",
  "language": "ko",
  "status": "normalized"
}