{
  "source": "kosha",
  "source_type": "portal_api",
  "doc_category": "kosha_opl",
  "source_id": "43652",
  "title": "[안전보건규칙 개정] 지붕작업 안전수칙",
  "title_normalized": "지붕작업 안전수칙",
  "body_text": "",
  "has_text": false,
  "content_length": 0,
  "hazards": [
    "추락"
  ],
  "work_types": [
    "지붕"
  ],
  "equipment": [],
  "tags": [],
  "url": "https://portal.kosha.or.kr/api/portal24/bizA/p/files/downloadAtchFile?atcflNo=FL00016365469&atcflSeq=1",
  "file_url": "https://portal.kosha.or.kr/api/portal24/bizA/p/files/downloadAtchFile?atcflNo=FL00016365469&atcflSeq=1",
  "pdf_path": "",
  "file_sha256": "",
  "industry": "건설업",
  "published_at": "20211119",
  "collected_at": "2026-04-22",
  "language": "ko",
  "status": "mapped"
}