{
  "source": "kosha",
  "source_type": "portal_api",
  "doc_category": "kosha_opl",
  "source_id": "39944",
  "title": "[중대재해사례 OPL]에어재킷을 착용하고 용접 작업 중 화재 사고",
  "title_normalized": "에어재킷을 착용하고 용접 작업 중 화재 사고",
  "body_text": "",
  "has_text": false,
  "content_length": 0,
  "hazards": [
    "화재폭발"
  ],
  "work_types": [
    "용접"
  ],
  "equipment": [],
  "tags": [],
  "url": "https://portal.kosha.or.kr/api/portal24/bizA/p/files/downloadAtchFile?atcflNo=FL00014175372&atcflSeq=1",
  "file_url": "https://portal.kosha.or.kr/api/portal24/bizA/p/files/downloadAtchFile?atcflNo=FL00014175372&atcflSeq=1",
  "pdf_path": "",
  "file_sha256": "",
  "industry": "제조업",
  "published_at": "20181119",
  "collected_at": "2026-04-22",
  "language": "ko",
  "status": "mapped"
}