{
  "source": "kosha",
  "source_type": "portal_api",
  "doc_category": "kosha_opl",
  "source_id": "52005",
  "title": "[중대재해] 외벽 퍼티작업을 위해 달비계에 탑승 중 떨어짐",
  "title_normalized": "외벽 퍼티작업을 위해 달비계에 탑승 중 떨어짐",
  "body_text": "",
  "has_text": false,
  "content_length": 0,
  "hazards": [
    "추락"
  ],
  "work_types": [],
  "equipment": [
    "달비계"
  ],
  "tags": [],
  "url": "https://portal.kosha.or.kr/api/portal24/bizA/p/files/downloadAtchFile?atcflNo=HTR2025121814031990642649&atcflSeq=1",
  "file_url": "https://portal.kosha.or.kr/api/portal24/bizA/p/files/downloadAtchFile?atcflNo=HTR2025121814031990642649&atcflSeq=1",
  "pdf_path": "",
  "file_sha256": "",
  "industry": "건설업",
  "published_at": "20251218",
  "collected_at": "2026-04-22",
  "language": "ko",
  "status": "mapped"
}