{
  "source": "kosha",
  "source_type": "portal_api",
  "doc_category": "kosha_opl",
  "source_id": "50445",
  "title": "(미얀마)크레인 작업 사망사고 유발 고위험요인(SIF)",
  "title_normalized": "(미얀마)크레인 작업 사망사고 유발 고위험요인(SIF)",
  "body_text": "အǳȢရာယ်ြဖစ်ǳိုင်ေြခြမင့်မားေသာ\nအေƭကာင်းရင်းများ\nချိတ်ဆက်မ˪ကိရိယာမှားယွင်းြခင်း(ြခစ်ရာ၊ပံုပျက်ြခင်း၊ပျက်စီးမ˪၊ဝရိန်\nခȁတ်ယွင်းြခင်း၊စသည်တို့)\nချိတ်ဆက်နည်းများမှားယွင်းြခင်း\nကာကွယ်ေရး\nလုပ်ေဆာင်ချက်များ\nကုန်ပစȗည်းပို့ေဆာင်ေရးလမ်းေƭကာင်းများအားလံုးကိုစစ်ေဆးǳိုင်ေသာ\nတည်ေနရာတစ်ခုမှကရိန်းစက်ေမာင်းǳှင်ြခင်း\nƳကီးƭကပ်သူသတ်မှတ်ြခင်းမှတစ်ဆင့်အချက်ြပမ˪များအတိုင်းသယ်ယူပို့ေဆာင်ြခင်း\nǹသဆǷǻǽမȁဖစ်ǹစǵǷင်ǹသǴ\nSIF\nကာကွယ်ေရး\nလုပ်ေဆာင်ချက်များ\nƳကိုးဆွဲကိရိယာများစွန့်ပစ်ြခင်း(စီမံခန့်ခွဲြခင်း) ဆိုင်ရာစံǳ˪န်းများေရးဆွဲြခင်း\nƳကိုးဆွဲပစȗည်းများပျက်စီးမ˪များကိုပံုမှန်စစ်ေဆးြခင်း(ပျက်စီးသည့်ပစȗည်းကို\nစွန့်ပစ်ြခင်း)\nေလးလံေသာပစȗည်းများကိုကိုင်တွယ်ြခင်းǳှင့်ပတ်သက်ေသာလုပ်ငန်းစီမံချက်\nတွင်ပို့ေဆာင်သည့်ပစȗည်းများ၏ပံုစံ/အရွယ်အစားǳှင့်ဟန်ချက်ကိုထိန်းသိမ်းရန်\nသင့်ေလျာ်ေသာƳကိုးတပ်နည်းများ*ကိုထည့်သွင်းပါသည်။\nသင့်ေလျာ်ေသာƳကိုးဆွဲနည်းများǳှင့်ပတ်သက်၍အလုပ်သမားများအတွက်\nƳကိုတင်ေလ့ကျင့်သင်ƭကားမ˪များကိုေစာင့်ƭကည့်ြခင်းǳှင့်အေကာင်အထည်ေဖာ်ြခင်း။\nSIF\nSerious Injury & Fatality\nကရိန်းေမာင်းသူများအတွက်\nြမင်ကွင်းများကိုǹှင်းလင်းေအာင်\nမေဆာင်ရွက်ြခင်း\n၁၅.၃%\nချိတ်ဆက်မ˪ကိရိယာ\nမှားယွင်းြခင်း*\n* ြခစ်ရာ၊ပံုပျက်ြခင်း၊ပျက်စီးမ˪၊\nဝရိန်ခȁတ်ယွင်းြခင်း၊စသည်တို့။\n၁၂.၁%\nချိတ်ဆက်နည်းများမှားယွင်းြခင်း\n၁၁.၃%\n미얀마어\nဓားေတာင်သံုးအဓိကအလုပ်သံုးခု\nေသဆံုးǳိုင်သည့်မေတာ်တဆမ˪များြဖစ်လွယ်ေစသည့်အǳȢရာယ်ǹှိǳိုင်ေြခ\nြမင့်မားေသာအလုပ်/အေြခအေနǳှင့်မေတာ်တဆမ˪ ြဖစ်ေစေသာ\nအေƭကာင်းရင်းများကိုဆိုလိုသည်။\nကာကွယ်ေရး\nအစီအမံများ\nကာကွယ်ေရး\nအစီအမံများ\nကာကွယ်ေရး\nအစီအမံများ\nအǳȢရာယ်ြဖစ်ǳိုင်ေြခအေƭကာင်းရင်း\nစƸကˣေပါ်တွင်မတည်Ʊငိမ်ေသာခန့်ထားမ˪\nအǳȢရာယ်ြဖစ်ǳိုင်ေြခအေƭကာင်းရင်း\nအǳȢရာယ်ြဖစ်ǳိုင်ေြခအေƭကာင်းရင်း\n2025-외국인전담팀-729",
  "has_text": true,
  "content_length": 1540,
  "hazards": [
    "충돌"
  ],
  "work_types": [
    "양중"
  ],
  "equipment": [
    "크레인"
  ],
  "tags": [],
  "url": "https://portal.kosha.or.kr/api/portal24/bizA/p/files/downloadAtchFile?atcflNo=HTR2025091809052098136867&atcflSeq=1",
  "file_url": "https://portal.kosha.or.kr/api/portal24/bizA/p/files/downloadAtchFile?atcflNo=HTR2025091809052098136867&atcflSeq=1",
  "pdf_path": "",
  "file_sha256": "",
  "industry": "건설업",
  "published_at": "20251002",
  "collected_at": "2026-04-22",
  "language": "ko",
  "status": "mapped"
}