{
  "source": "kosha",
  "source_type": "portal_api",
  "doc_category": "kosha_opl",
  "source_id": "50829",
  "title": "키메세지(17호_폭발)",
  "title_normalized": "키메세지(17호_폭발)",
  "body_text": "동영상\nOPS\n동영상\n화기작업중폭발사고\n용접용단시화재폭발예방\n용접용단화재·폭발재해예방\n2025-교육혁신실-1037\n가연성물질이있는장소에서용접등작업시\n- 불티비산방지조치, 소화설비설치, \n주기적환기등안전수칙이행\n내부위험물을완전히제거한후작업실시\n사전에위험물정보및발생가능한위험성, \n비상시대피요령등교육실시\n폭발\n(‘25.8.13.) 충남소재제조업사업장에서배관용접작업중폭발<사망1명>\n(‘25.8.3.) 경북소재제조업사업장의반응기에서원인미상의화재폭발<사망1명, 부상3명>\n주요사고사례\n안전작업방법\n콘텐츠링크\n스마트폰APP\n위기탈출안전보건설치\n안전보건공단\n산업안전포털\n고용노동부\n중대재해사이렌\n안전보건자료실\n검색\n17호\n책자\n화재폭발사고예방핸드북",
  "has_text": false,
  "content_length": 358,
  "hazards": [
    "화재폭발",
    "화학물질"
  ],
  "work_types": [
    "용접",
    "배관"
  ],
  "equipment": [],
  "tags": [],
  "url": "https://portal.kosha.or.kr/api/portal24/bizA/p/files/downloadAtchFile?atcflNo=HTR2025091208490971846621&atcflSeq=1",
  "file_url": "https://portal.kosha.or.kr/api/portal24/bizA/p/files/downloadAtchFile?atcflNo=HTR2025091208490971846621&atcflSeq=1",
  "pdf_path": "",
  "file_sha256": "",
  "industry": "제조업",
  "published_at": "20250912",
  "collected_at": "2026-04-22",
  "language": "ko",
  "status": "mapped"
}