{
  "source": "kosha",
  "source_type": "portal_api",
  "doc_category": "kosha_opl",
  "source_id": "39673",
  "title": "[외국인 노동자용 OPL] 동티모르_제조업",
  "title_normalized": "동티모르_제조업",
  "body_text": "EAST TIMOR\n(Bandu Entrada) Bandu entrada ba lokasaun ida nebe iha potensialidade ba sufokasaun \n    (출입금지) 질식 위험장소 출입금지 조치\n(Medida) Sukat gas konsentrasaun   (측정) 가스 농도 측정\n(Ventilasaun) Halo lakan exaustor (환기) 환기팬 가동\n(Hatais ekipamentu protesaun nian) Sé ventilasaun la posivel ida, hatais respirador ár \n    nian ou maskara ár fornese\n   (보호구 착용) 환기 불가능 시 공기호흡기 또는 송기마스크 착용 \nSulfato de hidrogênio hamorun durante serbisu \nreparasaun ba bee fatin nian \n집수조 수리작업 중 황화수소에 중독\n양돈농장 돼지우리(돈사)와 중간 집수조를 연결하는 배관이 막혀 이를 막대기로 뚫는 작업 중 막대기가 집수조 아래로 떨어지자 사다\n리로 내려가 주우려다 황화수소에 중독\nVitima ida koko tok atu hamoos  kanu maka naktiba nebe liga fahi ida no bee fatin ida iha fahi \npekuária ninian, uza ai tonka ida no depois ai tonka nee monu tama ba bee fatin. Nia mos sa'e ba \neskada no tuun ba atu foti buat nee, nia mos kona morun ho sulfato de hidrogênio \nFalta konxiénsia konaba perigu hosi sulfato de hidrogênio\n    황화수소 위험성 인식 부족\n- (Karakterístika) morun maka alta no kauza mate kedas duni sekuandu konsentrasaun to'o\n  ona 0.1-0.2% (alta konsentrasaun halebu nervo olfatório s → la bele horon saida deit) \n  (특성) 독성이 강해 농도가 0.1~0.2%에 이르면 즉사(고농도일 경우 후각 마비 → 냄새 못 느낌)\n- Mekanismu hosi jerasaun sulfato de hidrogênio iha fatin naktaka (oksijéniu la tama ba kakutak laran \n  hanesan substansia ne'e lori raan nia abilidade atu transporte oksijéniu, kauza mate kedas) \n  밀폐공간에서의 황화수소 발생기전(혈액의 산소 운반 기능을 뺏어 뇌에 산소 전달이 안 되어 즉사) \n◈ Sekuandu rai simentu (foer, sedimentu, sel-seluk tan.) hosi sedimentasaun klu'ak ou reservatorio maka \n     kedok hela, totál hosi sulfato de hidrogênio aumenta neineik o → A Ventilasaun ida sei persija beibeik sekuandu serbisu\n    침전지·저류조 등의 바닥층(스컴, 퇴적물 등)을 휘저을 경우 황화수소 발생량 급속히 증가 → 작업 중 지속적 환기 필요 \nFalta atu aplika programa serbisu fatin limitadu ida ba serbisu iha fatin naktaka\n    밀폐공간 작업 시 밀폐공간 작업프로그램 미실시  \nKauza hosi asidente 재해발생 원인\nProsidementu Serbisu Seguransa 안전작업 방법\nKazu asidente 재해사례\n2018-교육미디어-364\nPrograma serbisu \nfatin limitadu\n\n만화로 보는 재해사례\nAsidente animadu nia situasaun\nSulfato de hidrogênio hamorun durante serbisu reparasaun ba bee fatin \n집수조 수리작업 중 황화수소에 중독\nIha fatin naktaka ida, ventilasaun adekuadu hanesan buat \nsuperiodade nian!\n밀폐공간작업, 충분한 환기가 무엇보다 중요합니다 !\n돼지우리 집수조 연결배관에 돼지분이 쌓여 막히자, 분뇨 차량\n의 진공 압력을 이용해 배관을 뜷는 작업을 하고 있습니다.\n돼지우리 집수조인 밀폐공간에 아무런 안전조치 없이 들어가 \n황화수소에 중독, 1명이 사망한 재해입니다. \n배관이 막혔어요!\n어! 막대기가…\n다음에 또 사용해야 되는데…\n공간이 밀폐되어 위험요소가 있는 경우, \n밀폐공간 작업 프로그램을 수립하고 표준화된 \n안전보건절차에 따라 작업해야 합니다. \n작업 전 환기는 필수입니다. \n김씨 어디 있어요?\n애애앵~ \n집수조 내부에 떨어진 작업공구를 줍기 위해 \n   아무런 안전조치 없이 사다리를 이용해 \n       내려갑니다.\n냄새가 심하네…\nAsidente ida ne'e mosu sekuandu vitima tama \nba fahi nia bee fatin nebe iha fatin naktaka no \nla uza medida seguransa saida deit, no sofre \nmorun ba sulfato de hidrogênio, depois halo \nnia mate.\nKanu ne'e naktiba!\nHa! Ai tonka ne'e monu…\nHau persija uza buat ne'e iha \ntempu seluk…\nSé fatin naktaka no lori risku ba \nsufokasaun, persija liu atu aplika \nprograma serbisu iha fatin naktaka \nno tuir saude estandardiza no \nprosidementu seguransa nian. \nAntes serbisu, ventilasaun hanesan \nbuat ida maka nesesariu.\nIta iha nebe, Sr. Kim?\nWhee-yoo, whee-yoo\nNia tuun hodi eskada la ho medida seguransa \nsaida deit atu foti ekipamentu maka monu tama \nba bee fatin nia laran \nIis loos ne'e…\nDepois foer hosi fahi nee sai barak ona no halo \nnaktiba ba kanu maka liga fahi nia luhan ho \nbee fatin, ida ne'e klaru duni atu uza buat mo'at \nrai rahun ou foer hosi karreta lixu nian.  \n\nEAST TIMOR\n섬유 재단기란?\nSaida testil besi tesi?\n섬유 재단기는 가죽, 면직물, 하드보드 및 기타 시트 등을 자르는 기계를 말한다. 일반적인 섬유 재단기는 커터를 회전시켜 시트를 절단\n하며, 소음, 섬유분진 등이 발생한다. \nSerbisu ho seguru sekuandu uza besi tesi testil \nnian \n섬유 재단기 사용 시 작업 안전\nSekuandu hatama hena ba makina namkurut nian iha fabrika testil, vitima nia liman sorin \nkanek hamutuk ho hena no dada ba oin tama ba fatin entre namkurut nia lulun no hadulas nia \nmakina  \nTestil besi tesi hanesan makina ida maka tesi kulit, katun, ai kabelak, no tipu seluk hosi hena. \nTestil besi tesi nian tesi hena ho halo rotasaun, halo barulhu, fibra rahun, sel-seluk tan.\n섬유제품제조 사업장 내에서 샤링기에 원단을 끼우는 작업 중 회전하는 샤링 롤러와 가이드 롤러 사이에 좌측 팔이 원단과 함께 말려 \n들어간 재해\n2018-교육미디어-365\nBesi tesi testil nian 섬유 재단기 \nKazu asidente 재해사례\n\n안전대책 \nMedida Seguransa\nSekuandu trabalhador ida loke fibra nia ikun nebe namkurut ona, risku para ninia liman kona \ntesi tamba kaer kro'at hosi besi tesi ne'e. \nInstalar buat seguransa ida atu prevene kontaktu ho tesi nia ulun no kro'at ho asegura eskala \npermanente hosi tudik tesi nian maka tau, no instalar buat interligado ida. \nRisku ba trabalhador namdoras iha mina, rai rahun, fibra, sel-seluk tan, iha rai simentu besik makina \nFornese estrator ida atu hamoos fatin iha seguransa parte no instalar sistema supa nian atu \nprevene mina taretek.\n Risku ba isin nia parte kanek todan tamba kontaktu ho kro'at durante treinamentu ou serbisu \n   reparasaun \nxintu, polia, roda maka nakloke hotu-hotu, no buat transmisaun elektrisidade seluk, tenke taka \nhotu.\n\u0007Risku ba ahi sunu tamba inisiu ahi lakan sekuandu fibra ou mina nia restu sei iha rai simentu \nbesik makina \nSekuandu makina multi tesi uza hela, la iha ema bele tama ba fatin entre faixa ou moru proteje \nnia kotuk to'o lulun nain para hadulas no butaun xave hela \nRisku  ba trabalhador kaer tiha no habit iha parte transmisaun elektrisidade hanesan roda, \nxintu, polia, sel-seluk tan. \nSekuandu naklekar oin maka silu tiha ona, iha risku hanesan dada tama entre lulun nain sira, \nentaun tenki uza ekipamentu liman nian. \nRisku fafo'at no kona kaer entre lulun nain maka opera hela sekuandu trabalhador hametin \nfibra nia ninin sorin ou hatama buat ne'e ba makina laran\nTrabalhador ida tenke halo inspesaun ba makina lor-loron no reporta ba sira nia diretór \nsekuandu iha reparasaun ruma maka persija. \n작업자가 주름이 잡힌 섬유의 가장자리를 펼 때 손이 재단기의 칼에 접촉에 의한 절단 위험\n절단헤드와 칼날에 접촉하지 않도록 가드를 설치하며, 가드는 절단 칼날에서 일정한 거리를 유지하고, 연동장치를 설치한다\n기계 주변 바닥에 기름, 분진, 보풀 등에 작업자가 미끄러짐 위험\n\u0007가드의 틈을 청소하기 위한 이동식 진공청소기를 비치하고, 보풀이 쌓이는 것을 방지하기 위해 배출시스템이 설치되어야 한다.\n조정이나 수리 중에 작업자가 칼에 접촉에 의한 절단 위험\n\u0007모든 노출된 벨트, 풀리, 기어, 기타 동력전달장치들은 덮개를 부착해야 한다.\n보풀이나 기름이 기계 내부나 주변 바닥 등에 방치되어 있어 점화원에 의해 화재 발생 위험\n다중절단기계가 사용될 때는 회전이 멈추고 스위치를 자물쇠로 잠글 때까지는 누구도 방책 뒤나 구획사이로 들어갈 수 없도록 조치하\n여야 한다.\n기어, 벨트, 풀리 등의 동력전달부에 작업자가 말림 및 끼임 위험\n접힌 면을 펼 때는 롤러에 말릴 위험이 있으므로 전용 수공구를 사용하여 작업을 한다. \n작업자가 섬유의 가장자리를 펴거나 소재를 공급할 때 작동 중인 롤에 말림 및 끼임 위험\n작업자는 기계의 안전장치를 매일 점검하고, 수리가 필요하면 관리감독자에게 보고한다.\nAmeasa prioridade/fatór risku\n주요 유해·위험 요인\n\nEAST TIMOR\nSerbisu ho seguru sekuandu uza makina atu tesi \nsurat tahan \n종이재단기 사용 시 작업 안전\nFatór Ameasa/Perigu\n유해·위험 요인\n   Risku ida ba kona kaer sekuandu aumenta rasik sasaan matak nian\n   수동 원재료 투입 시 끼임 위험\n   Risku ida ba liman kona lasu  sekuandu muda sobun\n   이물질 제거작업 시 손 끼임 위험\n   Espozisaun ba perigu hanesan barulhu no rai rahun \n    소음, 분진 등 유해 요인에 노출  \n   Risku ba sofrementu ba musculoesqueletiku problema sekuandu kaer sasaan todan\n   중량물 취급 작업 시 근골격계 질환 발생 위험\n  \nRisku ba isin nia parte maka kona tesi hanesan trabalhador nia liman bainhira \nuza makina atu tesi surat tahan nian\n종이재단기 작업 중 작업자 손 등의 신체부위 절단사고 발생 위험\n2018-교육미디어-366\nKazu asidente 재해사례\n\nLista ba haree\n   Nota seguransa\n점검사항\n안전수칙\n   Haree buat seguransa nian no kondisaun operasaun hosi parte ida-idak \n    antes komesa serbisu\n    작업시작 전 각부의 작동상태 및 안전장치 확인\n   Komesa serbisu depois konfirma ona katak buat tesi ninia boot la liu hosi \n    kapasidade maka limita tiha ona hosi makina\n    재단물의 두께가 기계능력 한계를 넘지 않도록 확인 후 작업\n   Bandu hasobu ba buat seguransa nian hanesan guarda seguransa iha parte \n    tesi nian\n    절단부의 안전가드 등 안전장치 임의 해체 금지\n   Aneksu taka seguransa iha ain nia pedal atu prevene operasaun la espera \n    ida hosi makina tesi nian \n    재단기의 불시작동 방지를 위해 풋스위치 보호덮개 부착\n종이재단기 작업  안전대책 및 수칙 \n광전자식 안전장치\nOptoelektroniku buat seguransa\nAin pedal ninia buat taka seguru\nAin pedal nian\n풋 스위치\n풋 스위치 보호덮개\n종이재단기 작업  안전대책 및 수칙  \nMedida seguransa no prosidementu sekuandu kaer \nmakina tesi surat tahan ida\n   Hala'o inspesaun segurasan depois troka tudik tizora \n    전단날 교체 후 안전점검 실시\n   Hala'o inspesaun kada ful-fulan ou lor-loron liu hosi funsionariu ma",
  "has_text": true,
  "content_length": 8000,
  "hazards": [
    "추락",
    "끼임",
    "충돌",
    "화재폭발",
    "질식",
    "중량물",
    "화학물질",
    "협착",
    "전도",
    "비래낙하",
    "소음진동",
    "온도"
  ],
  "work_types": [
    "용접",
    "배관",
    "밀폐공간",
    "해체",
    "운반",
    "기계정비",
    "절단",
    "청소"
  ],
  "equipment": [
    "사다리",
    "절단기",
    "안전대"
  ],
  "tags": [],
  "url": "https://portal.kosha.or.kr/api/portal24/bizA/p/files/downloadAtchFile?atcflNo=FL00014175105&atcflSeq=1",
  "file_url": "https://portal.kosha.or.kr/api/portal24/bizA/p/files/downloadAtchFile?atcflNo=FL00014175105&atcflSeq=1",
  "pdf_path": "",
  "file_sha256": "",
  "industry": "제조업",
  "published_at": "20180808",
  "collected_at": "2026-04-22",
  "language": "ko",
  "status": "mapped"
}