{
  "source": "kosha",
  "source_type": "portal_api",
  "doc_category": "kosha_opl",
  "source_id": "32860",
  "title": "(제조,스리랑카)Safety and Healthcare Manual for Foreign Workers-Manufacturing Industry : Catapult processing (2) 외국인 근로자 안전보건 매뉴얼 - 제조업 : 사출기 가공(2)",
  "title_normalized": "(제조,스리랑카)Safety and Healthcare Manual for Foreign Workers-Manufacturing Industry : Catapult processing (2) 외국인 근로자 안전보건 매뉴얼 - 제조업 : 사출기 가공(2)",
  "body_text": "",
  "has_text": false,
  "content_length": 0,
  "hazards": [],
  "work_types": [],
  "equipment": [],
  "tags": [],
  "url": "https://portal.kosha.or.kr/api/portal24/bizA/p/files/downloadAtchFile?atcflNo=FL00014168648&atcflSeq=1",
  "file_url": "https://portal.kosha.or.kr/api/portal24/bizA/p/files/downloadAtchFile?atcflNo=FL00014168648&atcflSeq=1",
  "pdf_path": "",
  "file_sha256": "",
  "industry": "제조업",
  "published_at": "20120831",
  "collected_at": "2026-04-22",
  "language": "ko",
  "status": "normalized"
}