{
  "source": "kosha",
  "source_type": "portal_api",
  "doc_category": "kosha_opl",
  "source_id": "45855",
  "title": "[조선업] 안전한 보호구 착용 가이드(20개언어,국문)",
  "title_normalized": "안전한 보호구 착용 가이드(20개언어,국문)",
  "body_text": "안전인증품*\n자율안전확인신고품*\nABE형\n낙하·비래·추락·감전\nAB형\n낙하·비래·추락\nAE형\n낙하·비래·감전\nA형\n낙하·비래\n물체의 낙하·비래·추락에 의한  \n위험을 방지 또는 경감, 머리부위  \n감전에 의한 위험 방지\n물체의 낙하·비래·추락에 의한  \n위험 방지 또는 경감\n물체의 낙하·비래에 의한 위험을  \n방지 또는 경감, 머리부위 감전에  \n의한 위험 방지\n물체의 낙하·비래에 의한  \n위험 방지 또는 경감\n*  안전인증(인증서) : 안전인증대상품을 제조·수입하는 경우 안전인증기준에 맞는지 의무적으로 안전인증을 받음\n*  자율안전확인신고(증명서) :  인증대상이 아닌 유해·위험기계 등을 제조·수입하는 경우 안전에 관한 성능이 기준에 맞는지 확인하여 신고\n안전모는 제조사가 권장하는 주기에 맞추어 교체하고, 손상·파손된 제품은 사용하지 않습니다. \n사용자의 신체조건 및 작업장소에 적합한 안전모를 선택하고, 머리에 알맞도록 조절하여 사용합니다.\nKCs 인증을 \n꼭 확인하세요!\n자세한 내용은 \n산업안전보건인증원 \n홈페이지에서 확인\n한국산업안전보건공단 인증필\n안전인증품목 : 안전모\n형식·모델명 : XXXX\n용량·등급 : XXXX\n안전인증번호 : ** - AV * CQ - ****\n안전인증일자 : 20**. **. **.\n제조일자 : 20**. **. **.\n제조사명 : ㈜XXXX\n안전인증 표시\n안전모\n작업용도에 맞는 안전모 용량·등급(ABE, AB, AE, A)을 선택하고, 안전인증제품을 사용합니다. \n안전모 착용 전에는 모체의 파손·변형 등 제품의 이상 유무를 확인합니다.\n신체조건 등 사용자에게 적합한 사이즈를 선택하고, 사용자 머리 크기에 맞도록 착장체의  \n머리고정대를 조절합니다. 대부분의 안전모는 사이즈를 조절할 수 있습니다.\n턱끈을 조여서 안전모가 벗겨지지 않도록 고정하여 사용합니다.\n사용기간이 오래된 제품, 손상·파손된 제품 등은 사용하지 않습니다.  \n한번이라도 충격받은 안전모는 육안상 문제가 없어보여도 안전모 성능에 영향이 있을 수  \n있으니 안전모는 제조사가 권장하는 주기에 맞추어 교체합니다.\n제품사용 전 제조사가 제공하는 해당제품의 「사용방법설명서」 를 확인하시기 바랍니다.\n2\n1\n3\n4\n5\n구매, 사용 지침\n착장체\n턱끈\n모체\n충격흡수제\n사용\n방법\nABE / AB\nAE / A\n(http://kosha.or.kr/oshci)\n안전모  안전한 보호구 착용 가이드\nS\nH\nI\nP\nB\nU\nI\nL\nD\nI\nN\nG\n2023-교육혁신실-1008\n\n안전인증 표시\n그네식안전대는 추락 시 충격하중을 분산시켜 신체보호 효과가 뛰어납니다.\n  U자 걸이용\n  추락방지대\n  안전블록\n- 추락 시 신체를 붙잡아주는 목적\n-  작업발판이 설치되어 신체를 안전대에 의지할 필요가 없는 경우 사용\n-  로프를 구조물 등에 U자 모양으로 돌려 신체를  \n안전대에 지지\n-  신체를 안전대에 지지하여 두 손으로 작업이  \n필요한 경우 사용\n- 달비계, 고층사다리, 철골, 철탑 등의 상·하행 시 사용\n- 떨어짐을 억제할 수 있는 자동감김장치가 있음\n그네식안전대\n  1개 걸이용\n안전그네식 안전대 사용구분\n인증표시의 용량·등급을 확인하여 작업종류에 맞는 형태를 선택하고, 반드시 안전인증제품을 사용합니다.\n 안전대와 고정장치(앵커 등의 고정점), 안전대와 연결장치(죔줄, 카라비너 등) 등이 잘 연결되었는지  \n확인합니다. 추락방지를 위한 죔줄은 반드시 등 부위 D링에 연결합니다.\n 착용 전 로프의 마모, 금속제의 변형, 죔줄의 재봉상태 등 제품의 이상 유무를 확인합니다.  \n오래된 제품, 손상·파손된 제품은 사용하지 않습니다.\n 가슴조임줄, 벨트 등을 조절하여 사용자의 몸에 꼭 맞게 고정하여 착용합니다.  \n대부분의 안전대는 사이즈를 조절할 수 있습니다. \n추락방지대 사용 시각인된 사용방향 및구명줄의 직경을 확인 후 사용합니다.\n 안전블럭 사용 시 해당  「안전블럭과 함께 인증을 받은 그네식안전대」 를 사용합니다.  \n안전대 형태를 임의로 변경하거나 제품의 일부를 교체·변경하면 안전성능이 담보되지 않아 ‘위험’합니다.  \n인증받은 제품 전체를 그대로 사용하도록 합니다.\n제품사용 전 제조사가 제공하는 해당제품의 「사용방법설명서」 를 확인하시기 바랍니다.\n2\n1\n3\n4\n5\n6\n7\n그네식  \n사용 시\nKCs 인증을 \n꼭 확인하세요!\n자세한 내용은 \n산업안전보건인증원 \n홈페이지에서 확인\n한국산업안전보건공단 인증필\n안전인증품목 : 안전대\n형식·모델명 : XXXX\n용량·등급 : XXXX\n안전인증번호 : ** - AV * CY - ****\n안전인증일자 : 20**. **. **.\n제조일자 : 20**. **. **.\n제조사명 : ㈜XXXX\n신축조절기\n죔줄\n8자형링\n보조죔줄\n보조훅\n훅\n훅\n구조대\n추락방지대\n안전그네\n벨트식  \n사용 시\n구매, 사용 지침\n사용\n방법\n(http://kosha.or.kr/oshci)\n그네식안전대  안전한 보호구 착용 가이드\nS\nH\nI\nP\nB\nU\nI\nL\nD\nI\nN\nG\n\n \n 안전화\n 작업 조건, 안전화의 등급 \n \n \n \n \n,  \n“KCs 인증 마크”를 꼭! 확인\n \n. \n안전인증 표시\n안전화\n안전인증표시의 용량·등급을 확인하고, 반드시 안전인증을 득한 제품을 사용합니다.\n산업용 안전화는 물체의 낙하, 충격 또는 찔림 방지 목적 외 추가적인 성능에 따라 종류를 구분하고 \n있으니 작업현장에 알맞게 선택하여 사용합니다.\n - 고무제안전화 : 내수성\n - 정전기안전화 : 정전기의 인체대전을 방지\n - 절연화 : 저압의 전기에 의한 감전을 방지\n온라인 등에서 안전인증을 받지 않고 판매되는 작업화는 산업현장 사용에 적합하지 않습니다.  \n(미인증품 성능시험결과 발끝 및 발바닥 보호기능 부족)\n안전화의 형태를 임의로 변경(꺾어서 착용 등)하여 사용하거나, 제품의 일부(깔창 등)를  \n교체·변경 하면 안전성능이 확보되지 않습니다. 인증 받은 제품 전체를 사용자에게 알맞게  \n조절하여 사용하도록 합니다. \n제품사용 전 제조사가 제공하는 해당제품의 「사용방법설명서」 를 확인하시기 바랍니다.\n2\n1\n3\n4\n5\nKCs 인증을 꼭 확인하세요!\n자세한 내용은 산업안전보건인증원 홈페이지(http://kosha.or.kr/oshci) 에서 확인\n한국산업안전보건공단 인증필\n안전인증품목 : 안전화\n형식·모델명 : XXXX\n용량·등급 : XXXX\n안전인증번호 : ** - AV * CR - ****\n제조연월 : 20**. **. **.\n제조사명 : ㈜XXXX\n안전화 등급에 따른 사용장소\n중작업용\n   광업, 건설업 및 철광업 등에서 원료취급, 가공, 강재취급 및 운반, 건설업 등에서 중량물 운반 및 \n취급하는 작업장으로서 물체의 낙하, 충격 또는 날카로운 물체에 찔릴 우려가 있는 장소\n보통작업용\n   기계공업, 금속가공업, 운반, 건축업 등 공구 가공품을 손으로 취급하는 작업 및 차량 사업장, 기계 등을  \n운전 조작하는 일반작업장으로서 물체의 낙하, 충격 또는 날카로운 물체에 의해 찔릴 우려가 있는 장소\n경작업용\n   금속 선별, 전기제품 조립, 화학제품 선별, 반응장치 운전, 식품 가공업 등 비교적 경량의 물체를 취급하는  \n작업장으로서 물체의 낙하, 충격 또는 날카로운 물체에 의해 찔릴 우려가 있는 장소\n사용\n방법\n- 화학물질용안전화 : 화학물질로부터 유해위험을 방지\n- 발등안전화 : 발등보호\n- 절연장화 : 고압에 의한 감전방지 및 방수\n미인증 안전화\n몸통\n겉창\n내답판\n선심\n구매, 사용 지침\n안전화  안전한 보호구 착용 가이드\nS\nH\nI\nP\nB\nU\nI\nL\nD\nI\nN\nG\n\n  용접 시에 발생하는 유해광선으로부터 눈을 보호하고 실명 예방\n  열에 의한 화상 및 용접파편 등으로부터 안면 보호\n용접용보안면은 작업용도와 유해광선에 맞는 차광도를 선택합니다.\n미인증품은 사용하지 않습니다.\n안전성능이 담보되지 않아 눈과 안면 부상의 위험이 있습니다.\n소모품(필터 및 커버플레이트)은 반드시 정품(正品)으로 교체합니다.\n일반보안면에 보호성능이 확인되지 않은 차광필터를 부착하여 용접용으로 사용하지 않습니다.   \n일반보안면은 단순히 비산물로부터 얼굴을 보호할 뿐 유해광선을 차단할 수 없습니다.  \n온라인 등에서 일반보안면을 용접 시 사용가능하다고 판매하는 것은 허위광고입니다.\n제품 사용 및 교체 시에는 제조사가 제공하는 해당제품의 ‘사용방법 설명서’를  \n참조하시기 바랍니다.\n용접용보안면 주요 소모품은 성능이 확인된 \nKCs 인증 동일부품으로 교체하세요!\n미인증품, 성능이 확인되지 않은 일반\n유리필터는 눈을 보호할 수 없습니다.\nKCs 인증을 \n꼭 확인하세요!\n자세한 내용은 \n산업안전보건인증원 \n홈페이지에서 확인\n용접용보안면\n2\n1\n3\n4\n일반용접필터형\n핸드실드형\n5\n한국산업안전보건공단 인증필\n안전인증품목 : 용접용보안면\n형식.모델명 : XXXX\n용량.등급 : #9 ~ #16\n안전인증번호 : ** - AV * Ca - ****\n안전인증일자 : 20**. **. **.\n제조일자 : 20**. **. **.\n제조사명 : (주)XXXX\n자동용접필터형\n커버 플레이트\n커버 플레이트\n차광 플레이트(필터)\n동일제품\n사용\n방법\n구매, 사용 지침\n안전인증 표시\n(http://kosha.or.kr/oshci)\n용접용보안면  안전한 보호구 착용 가이드\nS\nH\nI\nP\nB\nU\nI\nL\nD\nI\nN\nG\n\n산업현장에서 사용하는 보안경은 용도, 차광도 등급 등에 따라 적합하게 사용하여야 하며,  \n“KCs 인증 마크”를 꼭! 확인해야 합니다. \n보안경\n안전인증품*(차광보안경)\n자율안전확인신고품*(일반보안경)\n눈에 해로운 자외선, 적외선 및 강렬한 가시광선 또는 비산물로부터 눈을 보호\n비산물로부터 눈을 보호\n자외선용\n적외선용\n복합용\n용접용\n유리보안경\n프라스틱보안경\n도수렌즈보안경\n자외선이  \n발생하는 장소\n적외선이  \n발생하는 장소\n자외선 및 적외선이 \n발생하는 장소\n산소용접작업 등과 같이  \n자외선, 적외선 및 강렬한  \n가시광선이 발생하는 장소\n렌즈의 재질이  \n유리인 것\n렌즈의 재질이  \n플라스틱인 것\n도수가 있는 것\n*  안전인증(인증서) : 안전인증대상품을 제조·수입하는 경우 안전인증기준에 맞는지 의무적으로 안전인증을 받음\n*  자율안전확인신고(증명서) :  인증대상이 아닌 유해·위험기계 등을 제조·수입하는 경우 안전에 관한 성능이 기준에 맞는지 확인하여 신고\n보안경의 사용구분\n안전인증표시의 용량·등급을 확인하고, 반드시 안전인증을 득한 제품을 사용합니다.\n미인증품이나 제품용도에 맞지 않은 보안경을 사용할 경우 안전성능이 담보되지 않아 눈 부상의  \n위험이 있습니다.\n차광 보안경은 작업용도와 유해광선에 알맞는 차광 등급을 선택합니다.\n차광 등급은 보호구안전인증고시 및 제조사가 제공하는 사용방법설명서 등을 확인하여 선택합니다.\n* 추가적으로 KS P 8141(차광보호구)의 작업에 따른 사용표준을 참조하시기 바랍니다.\n일반 보안경은 단순히 비산물로부터 눈 부위를 보호할 뿐 유해광선을 차단할 수 없습니다.\n렌즈 표면에 기포, 발포, 반점, 성형자국, 구멍 및 침전물 등이 없는지 확인 후 사용합니다.\n제품사용 전 제조사가 제공하는 해당제품의  「사용방법설명서」 를 반드시 확인하시기 바랍니다.\n2\n1\n3\n4\n5\n6\n※ 자율안전확인신고품의 경우 인증번호는 ‘**-AV*GM-****’ 으로 표기됩니다.\nKCs 인증을 \n꼭 확인하세요!\n자세한 내용은 \n산업안전보건인증원 홈페이지\n(http://kosha.or.kr/oshci)\n에서 확인\n한국산업안전보건공단 인증필\n안전인증품목 : 보안경\n형식·모델명 : XXXX\n용량·등급 : XXXX\n안전인증번호 : ** - AV * CZ - ****\n제조연월 : 20**. **. **.\n제조사명 : ㈜XXXX\n일반보안경\n차광보안경\n구매, 사용 지침\n안전인증 표시\n사용\n방법\n#1.7\n보안경  안전한 보호구 착용 가이드\nS\nH\nI\nP\nB\nU\nI\nL\nD\nI\nN\nG\n\n사용자의 작업 환경에 적합한 방진마스크를 선택하고, 얼굴에 알맞도록 조절\n하여 사용합니다.\n배기밸브가 있는 방진마스크는 바이러스 등의 외부배출 우려가 있어 감염병 \n예방용도로 사용을 권장하지 않습니다.\n방진마스크 형태 및 구조\n방진마스크 등급에 따른 사용장소\n격리식 전면형\n격리식 반면형\n직결식 전면형\n직결식 반면형\n반면형\n분리식\n안면부 여과식\nKCs 인증을 꼭 확인하세요!\n자세한 내용은 산업안전보건인증원 \n홈페이지에서 확인\n안전인증 표시\n한국산업안전보건공단 인증필\n안전인증품목 : 방진마스크\n형식·모델명 : XXXX\n용량·등급 : XXXX\n안전인증번호 : ** - AV*CT - ****\n안전인증일자 : 20**. **. **.\n제조일자 : 20**. **. **.\n제조사명 : ㈜XXXX\n산업용마스크\n보건용마스크\n특급\n   베릴륨 등과 같이 독성이 강한 물질들을 함유한 분진 등 발생장소,  \n석면 취급장소\n1급\n  금속흄 등과 같이 열적으로 생기는 분진 등 발생장소\n   기계적으로 생기는 분진 등 발생장소 \n(규소 등과 같이 2급 방진마스크를 착용하여도 무방한 경우는 제외)\n2급\n  특급 및 1급 마스크 착용장소를 제외한 분진 등 발생장소\n※ 배기밸브가 없는 안면부 여과식 마스크는 특급 및 1급 장소에서\n \n사용하면 안됩니다.\n안면부\n연결관\n흡기밸브\n배기밸브\n격장\n머리끈\n투시부\n투시부\n여과재\n연결관\n머리끈\n흡기밸브\n배기밸브\n연결관\n여과재\n안면부\n연결관\n배기밸브\n격장\n머리끈\n투시부\n투시부\n안면부\n흡기밸브\n여과재\n여과재\n금속\n장식\n안면부\n(여과재)\n배기밸브\n머리끈\n안면부\n(여과재)\n배기밸브\n흡기밸브\n머리끈\n안면부\n안면부\n여과재\n여과재\n(http://kosha.or.kr/oshci)\n산업용 방진마스크  안전한 보호구 착용 가이드\nS\nH\nI\nP\nB\nU\nI\nL\nD\nI\nN\nG\n\n안전인증표시의 용량·등급을 확인하고, 반드시 안전인증을 득한 제품을  \n사용합니다.\n방진마스크는 산소농도 18% 이상인 장소에서 사용하여야 합니다.\n작업종류에 따라 얼굴 전체(입, 코, 눈)를 덮을 수 있는 전면형 방진마스크나  \n입과 코를 덮을 수 있는 반면형 마스크를 선택합니다.\n안면부, 머리끈, 금속장치(코 누름쇠) 등을 사용하여 얼굴에 알맞게 조절합니다.\n사용자의 얼굴과 방진마스크 사이에 수건 등의 착용으로 밀착을 방해하지 않도록  \n합니다.\n방진마스크를 착용한 후 밀착도 자가 검사를 통하여 얼굴에 완전히 밀착되었는지  \n확인합니다.\n※  흡기밸브를 막고 숨을 들이 쉬고, 배기밸브를 막고 숨을 내쉬어 밀착도 자가 검사를 실시합니다.\n방진마스크의 머리끈을 귀에 걸어 사용하면 밀착도가 확보되지 않으므로 반드시  \n머리 뒤쪽에 걸어 사용합니다.\n방진마스크 제품의 일부(여과재 등)를 임의의 제품으로 교체·변경하면 안전성능이 \n확보되지 않습니다.\n인증 받은 제품(부속품 포함) 그대로 교체하시거나 제조사에 확인 하시기 바랍니다.\n제품사용 전 제조사가 제공하는 해당제품의 사용방법설명서를 확인하시기  \n바랍니다.\n구매, 사용 지침\n1\n2\n3\n4\n5\n6\n9\n8\n7\nS\nH\nI\nP\nB\nU\nI\nL\nD\nI\nN\nG\n산업용 방진마스크 \n안전한 보호구 착용 가이드\n\n사용자의 작업 환경 및 유해물질 등에 적합한 방독마스크를 선택합니다.\n사용자의 얼굴에 알맞도록 조절하여 사용하고, “KCs 인증마크”를 꼭! 확인해야 합니다.\n방독마스크 등급에 따른 사용장소\n방독마스크 종류별 정화통 외부 측면의 표시 색\nKCs 인증을 꼭 확인하세요!\n자세한 내용은 산업안전보건인증원 \n홈페이지(http://kosha.or.kr/oshci)\n에서 확인\n안전인증 표시\n한국산업안전보건공단 인증필\n안전인증품목 : 방독마스크\n형식·모델명 : XXXX\n용량·등급 : XXXX\n안전인증번호 : ** - AV*CU - ****\n안전인증일자 : 20**. **. **.\n제조연월 : 20**. **. **.\n제조사명 : ㈜XXXX\n고농도\n   가스 또는 증기의 농도가 100분의 2(암모니아는 100분의 3) 이하의 \n대기 중에서 사용하는 것\n중농도\n   가스 또는 증기의 농도가 100분의 1(암모니아는 100분의 1.5)이하의 \n대기 중에서  사용하는 것\n저농도 및 \n최저농도\n   가스 또는 증기의 농도가 100분의 0.1 이하의 대기 중에서 사용하는 \n것으로서 긴급용이 아닌 것\n방독마스크  형태 및 구조\n전면형\n반면형\n전면형(1안식)\n전면형(2안식)\n반면형\n격리식\n직결식\n머리끈\n연결관\n정화통\n배기밸브\n안면부\n안경\n구획(격장)\n흡기밸브\n머리끈\n배기밸브\n배기밸브\n안면부\n안경\n구획(격장)\n흡기밸브\n머리끈\n흡기밸브\n구획(격장)\n안경\n배기밸브\n머리끈\n정화통\n유기화합물\n",
  "has_text": true,
  "content_length": 8000,
  "hazards": [
    "추락",
    "끼임",
    "충돌",
    "감전",
    "화재폭발",
    "중량물",
    "화학물질",
    "협착",
    "전도",
    "비래낙하",
    "소음진동",
    "온도"
  ],
  "work_types": [
    "철골",
    "용접",
    "배관",
    "양중",
    "지붕",
    "운반",
    "방수",
    "조적"
  ],
  "equipment": [
    "달비계",
    "사다리",
    "안전대"
  ],
  "tags": [],
  "url": "https://portal.kosha.or.kr/api/portal24/bizA/p/files/downloadAtchFile?atcflNo=FL00020684325&atcflSeq=1",
  "file_url": "https://portal.kosha.or.kr/api/portal24/bizA/p/files/downloadAtchFile?atcflNo=FL00020684325&atcflSeq=1",
  "pdf_path": "",
  "file_sha256": "",
  "industry": "제조업",
  "published_at": "20240124",
  "collected_at": "2026-04-22",
  "language": "ko",
  "status": "mapped"
}